category,fulltext
human resources," \nST/IC/2023/11 \n \n63/63 \n23-09843 \n \nhealth-care services at a lower overall cost. The United Nations POS plan with Aetna \nalso allows plan participants to visit any in-network physician or health-care provider \nwithout first requiring a referral from a primary care physician.  \nPPO: A preferred provider organization (PPO) is a medical care arrangement in which \nmedical professionals and facilities provide services to subscribed clients at reduced \nrates. PPO medical and health-care providers are known as \xe2\x80\x9cpreferred providers\xe2\x80\x9d. \nPPO plans allow participants to visit any in-network physician or health-care provider \nthey wish without first requiring a referral from a primary care physician. \nPrognosis: A description of the likely course of a disease or illness provided by a \nphysician, including the patient\xe2\x80\x99s chances for recovery.  \nReasonable and customary: The prevailing pattern of charges for professional and \nother health services at the staff member\xe2\x80\x99s duty station or the approved location (for \nexample, the place of approved medical evacuation or regional area of care) where \nthe service is provided.  \nRecognized expenses: The expenses for services claimed, provided they are found to \nbe reasonable and customary at the duty station or, when obtained elsewhere in the \ncountry or at an approved medical evacuation location or regional area of care, at the \nplace provided. If the expenses claimed are found to be above what is considered \nreasonable and customary, then the recognized amount for the purpose of calculating \nreimbursement is the reasonable and customary amount as reasonably determined by \nthe third-party administrator.  \nSubscriber: An active or after-service participant enrolled in the United Nations \nhealth insurance programme or, upon the death of the former or the latter, the \nsurviving spouse (if any) or the eldest eligible child recognized and receiving a \nmonthly benefit from the United Nations Joint Staff Pension Fund.  \nThird-party administrator: An outside entity engaged by the United Nations for the \nprocessing and payment of United Nations health insurance programme claims. \n \n"
human resources, \nST/IC/2023/10 \n \n5/5 \n23-08932 \n \n \n \nEligible staff on board and \nin receipt of allowance \nprior to 1 January 2007 \n \nStaff who become eligible \nbetween 1 January 2007 \nand 31 December 2008 \n \nStaff who become \neligible on or after \n1 January 2009 \nCountry/territory \nCurrency \nDependent \nchild \nallowance \nSecondary \ndependant \nallowance  \nDependent \nchild \nallowance \nSecondary \ndependant \nallowance  \nDependent \nchild \nallowance \nSecondary \ndependant \nallowance \n \n \n \n  \n \n  \n \n \nUnited Kingdom of \nGreat Britain and \nNorthern Ireland \nPound sterling \n1 898 \n664  \n1 898 \n664  \n1 898 \n664 \nUnited States of \nAmerica and the \nrest of the world \nUnited States \ndollar \n2 929 \n1 025  \n2 929 \n1 025  \n2 929 \n1 025 \n \n
human resources,"ST/AI/2018/6/Rev.1 \n \n \n23-08928 \n8/8 \n \n \n \nSection 6 \n \n \nSecondary dependants \n \n \n \nDependency status of a secondary dependant \n \n6.1 A secondary dependant shall be the father, mother, brother or sister for whom \nthe staff member provides one half or more of financial support corresponding to at \nleast twice the amount of the dependency allowance. Pension income, such as \nretirement and disability benefits, and earnings resulting solely from investments \nshall not be included in the computation of the overall financial support of a staff \nmember\xe2\x80\x99s secondary dependant. If the secondary dependant is a sibling, that person \nmust also fulfil the age and school attendance requirements for a dependent child set \nout in section 3.1, unless the sibling is recognized as having a disability in accordance \nwith section 5.1. \n \n \n \nSecondary dependant benefit \n \n6.2 A secondary dependency allowance may be paid to eligible staff members for a \nsecondary dependant subject to the following conditions: \n \n(a) \nThe allowance is paid on account of only one secondary dependant; \n \n(b) \nThe staff member is not paid a dependent spouse allowance; \n \n(c) \nStaff members in the General Service and related categories, including \nNational Professional Officers, shall receive a dependency allowance with respect to \na secondary dependant when local conditions and/or the practices of comparator \nemployers call for the establishment of such an allowance. The amount of the \nallowance, if any, shall be provided in the local salary scale applicable at the duty \nstation. \n \n \n \nSection 7 \n \n \nFinal provisions \n \n7.1 The present administrative instruction shall enter into force on 1 January 2023. \n7.2 Administrative instruction ST/AI/2018/6 is hereby superseded. \n \n \n(Signed) Catherine Pollard \nUnder-Secretary-General for Management Strategy, Policy \nand Compliance \n \n"
human resources," \nST/IC/2023/9 \n \n13/13 \n23-08700 \n \n3. \nIndividual threshold amount  \n(line 1 (d) x line 2)/100 \n1 098.55  \n11. Subsidy (smaller of line 9 or 10) \n721.16 \n4. \nMonthly rent (less electricity cost) \n2 500.00  \n12. Subsidy in local currency \nTBD \n \nExchange rate \n \nRent, US$ \n2 500.00  \n \nIf line 3 is greater than line 4, STOP. No subsidy payable. \nCOMMENTS: The rental subsidy was calculated on the basis of the amount of reasonable rent recommended by the authorized \nofficial in the light of the staff member\xe2\x80\x99s family status and/or the conditions prevailing in the local housing market. \n \n \nExample 3. Rental deduction. Staff member is P-2/VIII, in receipt of a spouse allowance, and in receipt of housing \nassistance from the Government in the form of subsidized rent. Rent paid by the staff member is US$  250 per month, \nexclusive of electricity cost. \nRental deduction calculation: \n \nDuty station: X \nMultiplier \n38.5 \n1. Total income \nUS$ \n \n \n \n \n(a) Monthly net base salary \n \n \n(gross less staff assessment) \n5 010.42  \n5. Individual rental deduction threshold \namount (64 per cent of line 3) \n906.98 \n \n(b) Post adjustment \n1 929.01  \n6. Excess of individual rental deduction \nthreshold amount over rent (line 5 less \nline 4) \n656.98 \n \n(c) Special post/spouse/single parent \nallowance \n416.37  \n7. Percentage deduction \n80.00 \n(d) Total \n7 355.79  \n8. Rental deduction (line 6 x line 7)/100 \n525.59 \n2. Threshold percentage \n20.00  \nCOMMENTS: A rental deduction is levied on the staff \nmember on account of the fact that the monthly rent is \nsubstantially lower than the average rent used in \ncalculating the post adjustment index for the duty station. \nThe authorized official at the duty station has certified the \ndwelling to be of quality standard. \n3. Individual threshold amount  \n(line 1 (d) x line 2)/100 \n1 471.16  \n4. Monthly rent (less electricity cost) \n250.00  \n \nExchange rate \nRent, US$ \n250.00  \n \n \nExample 4. Rental deduction. Staff member is D-1/III, in receipt of a single parent allowance and in receipt of free \nhousing from the Government. \nRental deduction calculation: \n \nDuty station: Y \nMultiplier \n17.5 \n1. Total income \nUS$ \n \n \n \n \n(a) Monthly net base salary \n \n \n(gross less staff assessment) \n9 177.08  \n5. Individual rental deduction threshold \namount (64 per cent of line 3) \n804.68 \n \n(b) Post adjustment \n1 605.99  \n6. Excess of individual rental deduction \nthreshold amount over rent (line 5 less \nline 4) \n804.68 \n \n(c) Special post/spouse/single parent \nallowance \n646.98  \n7. Percentage deduction \n80.00 \n(d) Total \n11 430.06  \n8. Rental deduction (line 6 x line 7)/100 \n643.74 \n2. Threshold percentage \n11.00  \nCOMMENTS: A rental deduction is charged to the staff \nmember in view of the fact that the staff member is \nreceiving free housing from the Government. The \nauthorized official at the duty station has certified the \ndwelling to be of quality standard. \n3. Individual threshold amount  \n(line 1 (d) x line 2)/100 \n1 257.31  \n4. Monthly rent (less electricity cost) \n0.00  \n \nExchange rate \nRent, US$ \n0.00  \n \n"
human resources,"ST/SGB/2023/2 \n \n \n23-06798 \n6/6 \n \n \n \nReceptive activities: reading \n \n \n\xe2\x80\xa2 Thoroughly understand linguistically and/or conceptually complex written texts \nof various genres and lengths, capturing implicit meanings and subtleties, \nconcrete or abstract, including in unfamiliar contexts \n \n\xe2\x80\xa2 Understand a wide range of idiomatic and figurative language and sociocultural \nreferences \n \n \n \nReceptive activities: listening \n \n \n\xe2\x80\xa2 Understand without any notable effort, capturing implicit meanings and \nsubtleties, linguistically and/or conceptually complex texts delivered at an \naverage-to-fast rate in a range of varieties, including unfavourable situations \n \n\xe2\x80\xa2 Understand a wide range of idiomatic and figurative language and sociocultural \nreferences \n \n \n \nSpoken production and interaction \n \n \n\xe2\x80\xa2 Take part fluently in a variety of demanding situations, arguing opinions \nskilfully, building on various contributions and demonstrating the ability to take \nthe lead and to intervene diplomatically \n \n\xe2\x80\xa2 Produce a wide range of spoken texts of various purposes \n \n\xe2\x80\xa2 Relay and synthesize information contained in texts of varied typology and \ncomplexity in oral or written communication \n \n \n \nWritten production and interaction  \n \n \n\xe2\x80\xa2 Write reasonably complex and/or long texts in various genres  \n \n\xe2\x80\xa2 In demanding written exchanges, respond effectively, confidently matching \nregister and style to the communicative situation \n \n\xe2\x80\xa2 Relay and synthesize information contained in texts of varied typology and \ncomplexity in oral or written communication \n \n\xe2\x80\xa2 Proofread or edit one\xe2\x80\x99s own texts or texts produced by others \n \n"
human resources,"ST/AI/2010/4/Rev.2 \n \n \n23-01266 \n12/12 \n \n \n \nTermination indemnity \n \n15.5 Staff members holding temporary appointments exceeding six months shall be \npaid a termination indemnity in accordance with staff regulation 9.3 (c), annex III to \nthe Staff Regulations, staff rule 9.8 and the staff member\xe2\x80\x99s letter of appointment. This \napplies also to temporary appointments of an initial duration of six months or less \nthat are subsequently extended beyond six months. \n15.6 Staff members holding a temporary appointment of six months or less shall not \nbe paid a termination indemnity unless such payment is stipulated in the letter of \nappointment. Such termination indemnity shall not exceed an amount equivalent to \none week\xe2\x80\x99s pay for each month of uncompleted service. \n \n \n \nSection 16 \n \n \nPermanent residency \n \n \nStaff members recruited on the basis of a temporary appointment in the \ninternational Professional category or in the Field Service category at the F-6 or F-7 \nlevels who have permanent resident status in any country other than that of their \nnationality are exempt from the requirement to renounce such status upon appointment. \n \n \n \nSection 17 \n \n \nFinal provisions \n \n17.1 The present administrative instruction shall enter into force on its date of \nissuance. \n17.2 The provisions of  ST/AI/2010/4/Rev.1 shall continue to govern temporary job \nopenings advertised before the issuance of the present administrative instruction. In all \nother respects, the present administrative instruction supersedes ST/AI/2010/4/Rev.1. \n \n \n(Signed) Catherine Pollard \nUnder-Secretary-General for Management Strategy, \nPolicy and Compliance \n \n"
human resources," \nST/IC/2023/8 \n \n9/9 \n23-04440 \n \n \nIn the absence of a court document, an original notarized affidavit from \nthe custodial parent must be provided attesting that the staff member \nprovided continuing support and specifying the amounts paid during the \ncalendar year 2022, together with the proof of payment described above. \n \n(d) For a child between the ages \nof 18 and 21a \nStaff members who were not in receipt of an education grant should \nsubmit an original completed form P.41/B (certificate of school \nattendance) for the academic years 2021/22 and 2022/23. Where the \nacademic year coincides with the calendar year, form P.41/B should be \nsubmitted for 2022.  \n \nNo additional documentation for proof of full-time school attendance is \nrequired for a child for whom the staff member received an education \ngrant for the academic years 2021/22 and 2022/23. \n \n(e) For a child of a staff member \nwho is in receipt of a government \ngrant \nOriginal government assistance documents reflecting the amounts \nreceived each calendar year, including the currency of payment. \n4. For a single parent \nProvide all documentation required for each child as set out in \nparagraphs 3 to 3 (e) above, as applicable. In addition, proof of the status \nof the staff member must be submitted if not already on file (for example, \ndivorce decree, death certificate of former spouse, certificate of legal \nseparation or similar legal documents). \n5. For a secondary dependant who \nresides with the staff member  \nStaff member\xe2\x80\x99s certification of support, provided on the annual \ndeclaration form, is needed. For a secondary dependant who resides or \ncomes to reside with the staff member in 2022, proof of residency needs \nto be submitted. \n6. For a secondary dependant who \ndid not reside with the staff memberb \nProof of all payments made directly by the staff member to the secondary \ndependant for the required amount during the calendar year 2022, in the \nform of cancelled (i.e. paid) cheques, money orders or wire transfer \nreceipts or records of bank transactions.  \n \nCash transactions are not considered acceptable proof of support.  \nThe secondary dependant must be reflected as the recipient on all proof of \npayment, except for cases where transfers are made to a legal guardian. \n \nThe staff member must provide one half or more of the secondary \ndependant\xe2\x80\x99s support and, in any case, at least twice the amount of the \nsecondary dependency allowance. \n \n \na Dependency status is recognized through a period of vacation between academic years when the child enrols for full-time \nattendance during the regular academic year. Otherwise, the dependency status ceases on the last day of full-time attendance at \nthe educational institution. The required forms are available on iSeek (https://iseek.un.org/forms) or local human resources \noffices.  \n \nb At the time of establishment of an entitlement to a benefit for a secondary dependant, staff members should submit in person \ntheir own birth certificate, as well as the birth certificate or passport of the secondary dependant, with an original, completed \nform P.85 and proof of support as stated above. Please note that the birth certificates and/or passport must be original or \ncertified true copies. \n \n"
human resources,"ST/AI/2023/2 \n \n \n23-03076 \n6/6 \n \n9.5 In order to ensure reabsorption of the staff member on return from leave, the \nstaff member\xe2\x80\x99s head of entity4 shall ensure that a position is available at the same \nduty station, at the appropriate level and with functions reasonably comparable to \nthose discharged by the staff member before leave was taken. The staff member may \nbe required to undertake training in order to facilitate reabsorption. \n \n \n \nSpecial leave without pay in cases of death or emergency \n \n9.6 In accordance with staff rule 5.5, staff members may request special leave \nwithout pay upon the death of a member of the immediate family of the staff member, \nwhich includes a spouse, child, parent, brother or sister, or in case of serious personal \nor family emergency. Such leave shall normally be granted for a period of up to two \ncalendar weeks, plus necessary travel time, if applicable. \n \n \n \nSection 10 \n \n \nFinal provisions \n \n10.1 The present administrative instruction shall enter into force on 1 January 2023. \n10.2 The provisions of administrative instruction ST/AI/2005/2 (\xe2\x80\x9cFamily leave, \nmaternity leave and paternity leave\xe2\x80\x9d) shall apply to those staff members who were \neligible to 16 weeks of maternity leave, 4 or 8 weeks of paternity leave or 8 weeks of \nadoption leave, on or before 31 December 2022. \n10.3 ST/AI/2005/2 shall be abolished as of 31 December 2022, without prejudice to \nthe provisions of section 10.2 above. \n10.4 Sections 9.4 to 9.6 of administrative instruction ST/AI/2010/4/Rev.1 on the \nadministration of temporary appointments and sections 4.5 to 4.8 of ST/AI/2013/1 on \nthe administration of fixed-term appointment are hereby superseded. \n \n \n(Signed) Catherine Pollard \nUnder-Secretary-General for \nManagement Strategy, Policy and Compliance \n \n__________________ \n \n4 \xe2\x80\x9cHead of entity\xe2\x80\x9d has the meaning set forth in footnote 1 of the Secretary-General\xe2\x80\x99s bulletin \nST/SGB/2019/2 on delegation of authority in the administration of the Staff Regulations and \nRules and the Financial Regulations and Rules, as may be amended. \n"
human resources,"ST/SGB/2023/3 \n \n \n23-17567 \n4/4 \n \n \n \nSection 3 \n \n \nMonitoring \n \n3.1 Gender Focal Points shall regularly monitor progress made towards the \nachievement of gender balance goals in their respective entities and, as appropriate, \nshall be invited to and participate in joint meetings between the Office of Human \nResources or local administrative offices and entity leadership to assess such \nprogress.  \n3.2 Gender Focal Points shall assist, as appropriate, the Office of the Focal Point \nfor Women in the promotion by that office of efforts to achieve and ultimately \nmaintain gender balance in the Secretariat by contributing data, ideas, comments and \nexperiences on issues affecting the status of women in the Secretariat, as well as \nannual updates on their ability to carry out their functions, particularly with regard to \ntime and resource allocation.  \n \n \n \nSection 4 \n \n \nAuthority and respect for confidentiality \n \n4.1 Gender Focal Points shall have access to all information necessary for the \ndischarge of their functions, including access to statistics on gender balance in their \nrespective entities; access to information on forthcoming vacancies and human \nresources policies and practices affecting gender balance goals; and access to staff of \nthe local human resources or Executive Office, and senior management of the \nrespective entity, as required to carry out their functions.  \n4.2 In discharging their functions, Gender Focal Points shall respect the \nconfidentiality of all information received that is of a confidential nature. \n \n \n \nSection 5 \n \n \nFinal provisions \n \n5.1 The present bulletin shall enter into force on the date of its issuance. \n5.2 Secretary-General\xe2\x80\x99s bulletin ST/SGB/2008/12 of 1 August 2008, entitled \n\xe2\x80\x9cDepartmental focal points for women in the Secretariat\xe2\x80\x9d, is hereby superseded. \n \n \n(Signed) Ant\xc3\xb3nio Guterres \nSecretary-General \n \n"
human resources," \nST/AI/2010/3/Rev.3 \n \n13/13 \n24-00015 \n \n \n \nSection 11  \n \n \nPlacement authority outside the normal process \n \n11.1 The Assistant Secretary-General for Human Resources has the authority to place \nin a suitable job the following staff members when in need of placement outside the \nnormal process: \n \n(a) \nIncumbents, other than staff members holding a temporary appointment, \nof jobs reclassified upward for which an applicant other than the incumbent has been \nselected; \n \n(b) \nStaff members who return from secondment after more than two years \nwhen the parent entity concerned has made every effort to place them. \nAfter determining the availability of a suitable job in consultation with the head of \nentity and the staff member concerned, the Assistant Secretary-General for Human \nResources shall decide on the placement, in accordance with staff regulation 1.2 (c).  \n11.2 To expedite placement of successful candidates for the young professionals \nprogramme, the official with the delegated authority shall have the authority to place \nthose candidates in P-2 vacancies subject to geographical distribution that, after a \nperiod of three months, have not been filled. \n11.3 Vacancies for jobs directly financed by project funds or other extrabudgetary \nresources established at the P-1 or P-2 level for one year or more will be filled only \nthrough successful candidates for the young professionals programme, until such time \nas the list of successful candidates is depleted, or through the temporary promotion \nof successful \xe2\x80\x9cG to P\xe2\x80\x9d candidates who are willing to assume such jobs. For jobs that \ncontinue to be funded beyond two years, \xe2\x80\x9cG to P\xe2\x80\x9d appointees will be given the \nopportunity to confirm their willingness to relinquish their General Service jobs. \n11.4 The official with the delegated authority shall have the authority to select successful \ncandidates for the young professionals programme against P-2 vacancies in peacekeeping \noperations and special political missions. Candidates selected for P-2 vacancies in \npeacekeeping operations or special political missions from the list of successful \ncandidates for the young professionals programme shall be granted geographic status.  \n \n \n \nSection 12  \n \n \nFinal provisions and transitional measures  \n \n12.1 The present administrative instruction shall enter into force on 1 February 2024. \n12.2 The provisions of ST/AI/2010/3/Rev.1 shall continue to govern recruitment, \nplacement and promotion in respect of applications for job openings advertised before \nthe issuance of ST/AI/2010/3/Rev.2.  \n12.3 The provisions of ST/AI/2010/3/Rev.2 shall continue to govern recruitment, \nplacement and promotion in respect of applications for job openings advertised after \nits issuance, and before 1 February 2024.  \n12.4 In all other respects, the present administrative instruction (ST/AI/2010/3/Rev.3) \nsupersedes ST/AI/2010/3/Rev.2, with the exception of section 6.4 of ST/AI/2010/3/Rev.2 \nconcerning lateral move requirements, which will be applied as set out in section 6.4 of \nthe present administrative instruction. \n \n \n(Signed) Catherine Pollard \nUnder-Secretary-General for Management Strategy, \nPolicy and Compliance \n \n"
human resources,"ST/AI/2016/6/Amend.2 \n \n \n24-01654 \n2/2 \n \n \n \nTable 2 \n \n \nHardship allowance \n(Annual amounts in United States dollars) \n \n \nHardship category of duty station \nGroup 1 (P-1 to P-3) \nGroup 2 (P-4 and P-5) \nGroup 3 (D-1 and above) \n \n \n \n \nA \n\xe2\x80\x93 \n\xe2\x80\x93 \n\xe2\x80\x93 \nB \n6 110 \n7 330 \n8 560 \nC \n11 010 \n13 440 \n15 890 \nD \n14 670 \n17 130 \n19 550 \nE \n18 340 \n22 000 \n24 460 \n \n \n2. \nThe present instruction supersedes ST/AI/2016/6/Amend.1 and shall enter into \nforce on the date of its issuance. \n \n \n(Signed) Catherine Pollard \nUnder-Secretary-General for Management Strategy, \nPolicy and Compliance \n \n"
