category,fulltext
human resources," \nUnited Nations \n \nST/AI/2003/8/Amend.2\n \n \n \nSecretariat \n \n \n2 February 2009 \n \n \n09-22559 (E)    040209  \n*0922559* \n \n Administrative instruction \n \n \n \n Retention in service beyond the mandatory age of separation \nand employment of retirees \n \n \n \nThe Under-Secretary-General for Management, pursuant to section 4.2 of \nSecretary-General\xe2\x80\x99s bulletin ST/SGB/1997/1, amends subparagraph 6.1 (b) as \ncontained in administrative instruction ST/AI/2003/8/Amend.1, entitled \xe2\x80\x9cRetention \nin service beyond the mandatory age of separation and employment of retirees\xe2\x80\x9d, to \nread as follows: \n \n \n\xe2\x80\x9c(b) Language services staff may not be re-employed for more than \n125 days actually worked during a calendar year;\xe2\x80\x9d \n \nThe present instruction shall enter into force on 2 February 2009. \n \n \n(Signed) Angela Kane \nUnder-Secretary-General for Management \n \n"
human resources,ST/IC/1999/111\n4\nlocally recruited staff at designated duty stations away from\nHeadquarters\xe2\x80\x9d.\n
human resources,
human resources,"United Nations\nST/AI/2005/1\n \nSecretariat\n29 March 2005\n05-29158 (E)    010405\n*0529158*\nAdministrative instruction amending administrative\ninstruction ST/AI/1999/13\nRecording of attendance and leave\nThe Under-Secretary-General for Management, pursuant to section 4.2 of\nSecretary-General\xe2\x80\x99s bulletin ST/SGB/1997/1, amends administrative instruction\nST/AI/1999/13, entitled \xe2\x80\x9cRecording of attendance and leave\xe2\x80\x9d, as follows:\nSection 1.5 is replaced by the following text:\n\xe2\x80\x9c1.5 At the close of each twelve-month cycle provided for in staff rule 106.2\n(c), an annual record of attendance for every staff member shall be prepared,\nshowing the total sick leave and annual leave taken during that cycle, and the\nbalance of annual leave carried forward at the beginning of the new cycle.\xe2\x80\x9d\nThe present instruction shall enter into force on 1 April 2005.\nCatherine Bertini\nUnder-Secretary-General for Management\n"
human resources,"4\nST/AI/2005/3\nofficer or other appropriate official must be informed before the approved period\nexpires, where practicable with the submission of a medical certificate or report, as\nappropriate. The executive officer or other appropriate official shall inform the\nMedical Director or designated medical officer of the situation. The request for\napproval of sick leave during annual leave must be submitted together with the\nrequisite medical certificate or report, immediately upon return to duty.\nExtension of fixed-term appointments for utilization of sick leave entitlement\n3.9\nWhen a staff member on a fixed-term appointment is incapacitated for service\nby reason of an illness that continues beyond the date of expiration of the\nappointment, he or she shall be granted an extension of the appointment, after\nconsultation with the Medical Director or designated medical officer, for the\ncontinuous period of certified illness up to the maximum entitlement to sick leave at\nfull pay and half pay under staff rules 106.2 or 206.3.\n3.10 When a staff member\xe2\x80\x99s fixed-term appointment is extended solely to enable\nhim or her to utilize his or her sick leave entitlement, such extension shall not give\nrise to any further entitlement to salary increment, annual leave, sick leave,\nmaternity leave, paternity leave or home leave, although credit towards repatriation\ngrant may continue to accrue if the staff member has not returned to his or her home\ncountry. Sick leave on half pay during the period of extension may not be\nsupplemented by annual leave. In the event of death during the period of extension,\nthe period prior to the death may be taken into account in  the determination of the\ndeath benefit provided in staff rules 109.10 (a) (vi) or 209.11 (a) (v).\nSection 4\nFinal provisions\nThe present administrative instruction shall enter into force on 16 May 2005.\n(Signed) Andrew Toh\nOfficer-in-Charge\nDepartment of Management\n"
human resources,ST/AI/2005/3/Amend.1 \n \n \n07-60984 \n2 \n \n2. \nThe present instruction shall enter into force on 1 January 2008.  \n \n \n(Signed) Alicia B\xc3\xa1rcena \nUnder-Secretary-General for Management \n \n
human resources,"United Nations\nST/AI/2005/5\n \nSecretariat\n31 May 2005\n05-37126 (E)    080605\n*0537126*\nAdministrative instruction amending administrative\ninstruction ST/AI/400\nAbandonment of post\n1.\nPursuant to section 4.2 of Secretary-General\xe2\x80\x99s bulletin ST/SGB/1997/1 and for\nthe purpose of implementing General Assembly resolution 59/268 of 23 December\n2004, which approved the implementation of paternity leave throughout the\ncommon \nsystem, \nthe \nUnder-Secretary-General \nfor \nManagement \namends\nadministrative instruction ST/AI/400, entitled \xe2\x80\x9cAbandonment of post\xe2\x80\x9d, as follows:\nParagraph 5 is replaced by the following text:\n\xe2\x80\x9cThe absence of a staff member from his or her work, unless properly\nauthorized as leave under staff rule 105.1 (b), as special leave under staff rule\n105.2, as sick leave under staff rule 106.2 or as maternity or paternity leave\nunder staff rule 106.3, may create a reasonable presumption of intent to\nseparate from the Secretariat unless the staff member is able to give\nsatisfactory proof that such absence was involuntary and was caused by forces\nbeyond his or her control.\xe2\x80\x9d\n2.\nThe present instruction shall enter into force on 1 June 2005.\nAndrew Toh\nOfficer-in-Charge\nDepartment of Management\n"
human resources," \n \n9 \n \n \nST/AI/2006/2\n \n(e) \nFor hard copy records, details of the repacking and resealing of the \ncontainer for its return to permanent storage as follows: \n \n(i) \nThe identity of the container repacked and resealed and its contents; \n \n(ii) The date on, and the time at, which it was repacked and resealed; \n \n(iii) The identity of the official or officials of the Archives and Records \nManagement Section who repacked and resealed it; \n \n(iv) The office address at which the repacking and resealing took place; \n \n(v) \nThe identity of any other official or officials of the Archives and Records \nManagement Section who were otherwise present while the container was \nbeing repacked and resealed, the times during which they were present and the \nreason or reasons for their presence; \n \n(f) \nFor electronic copy records, the audit trail of the reclosing of the \ndatabase for permanent storage as follows: \n \n(i) \nThe name of the database reclosed; \n \n(ii) The date on, and the time at, which it was reclosed; \n \n(iii) The identity of the official or officials of the Archives and Records \nManagement Section who reclosed it; \n \n(iv) The secure non-networked storage device on which reclosing took place; \n \n(v) \nThe identifier of the server or workstation on which the database was \nreclosed; \n \n(vi) The office address at which reclosing took place; \n \n(vii) The identity of any other official or officials of the Archives and Records \nManagement Section who were otherwise present while the database was \nbeing reclosed, the times during which they were present and the reason or \nreasons for their presence. \n7.2 A scanned copy of the original signed versions of written authorizations of the \nSecretary-General granted in accordance with section 5 of Secretary-General\xe2\x80\x99s \nbulletin ST/SGB/2006/7 shall be stored in the ARMS electronic recordkeeping \nsystem. \n \n \n \nSection 8 \nFinal provisions \n \n8.1 The present instruction shall enter into force on 12 June 2006. \n8.2 The present instruction shall terminate on the date specified in or in \naccordance with section 3.3 of Secretary-General\xe2\x80\x99s bulletin ST/SGB/2006/7. \n \n \n(Signed) Christopher B. Burnham \nUnder-Secretary-General for Management \n \n \n"
human resources,"ST/AI/2007/3 \n \n \n07-43395 \n8 \n \nother duty stations who apply for after-service health insurance coverage under a \nplan administered at Headquarters must submit the relevant application forms \nthrough their administrative office, not directly to the Health and Life Insurance \nSection at Headquarters. Staff members separating from service at other duty \nstations who wish to apply for after-service health insurance coverage under a plan \nthat is not administered at Headquarters should contact the local human resources \noffice or the office administering their in-service health insurance coverage. \n7.4 Staff members who are close to retirement or early retirement should ensure \nthat they are provided with all relevant information concerning the after-service \nhealth insurance programme. Such information is available from the office \nadministering their in-service health insurance coverage. \n \n \n \nSection 8 \nTransfer from one health insurance plan to another \n \n8.1 At the time of retirement, a staff member may switch from the insurance plan \nwhich he or she had on an in-service basis to a health insurance plan which is more \nappropriate following separation from service, under certain conditions. For \nexample, a staff member who, while in active service, participated in a Headquarters \nhealth insurance plan, may switch to a non-United States-based plan if he or she will \nreside outside the United States following separation from service, provided that \ncovered dependants will also reside outside the United States. \n8.2 After-service health insurance participants who change their country of \nprimary residence following separation may also transfer from one insurance plan to \nanother if a different plan is more appropriate to the new country of residence. In \nsuch cases, the change in plan will become effective on the first day of the month \nfollowing receipt of written notification regarding the change in country of \nresidence or as soon thereafter as is practicable. With respect to health insurance \nplans available to after-service participants who reside in the United States, transfer \nfrom one plan to another may be made subject to the condition that there must be \ntwo years\xe2\x80\x99 coverage under any such plan before a change can be made. \n \n \n \nSection 9 \nFinal provisions \n \n9.1 This instruction shall enter into force on 1 July 2007.  \n9.2 Administrative instruction ST/AI/394 of 19 May 1994 and the related addenda \nand amendments are hereby abolished. \n \n \n(Signed) Alicia B\xc3\xa1rcena \nUnder-Secretary-General for Management \n \n"
human resources,"ST/AI/2008/1 \n \n \n08-32231 \n2 \n \n \n \nSection 3 \nResponsibility for the exhibit \n \n \nThe \nSecretariat \ndepartment/office, \nseparately \nadministered \norgan \nor \nprogramme of the United Nations or organization of the United Nations system or \npermanent or observer mission to the United Nations that has submitted a proposal \nfor an exhibit shall bear responsibility for the content of such exhibit. In the event \nthat the proposal for an exhibit originates from a non-governmental organization, or \nanother not-for-profit organization such as a foundation or museum, the entity \nformally supporting the proposal, as provided in section 4.1 of Secretary-General\xe2\x80\x99s \nbulletin ST/SGB/2008/6, shall bear responsibility for the content of the exhibit. \n \n \n \nSection 4 \nArrangements for the exhibit \n \n4.1 All exhibits authorized by the Exhibits Committee shall be organized and \ncoordinated with the Department of Public Information. \n4.2 Exhibits shall be displayed as approved by the Exhibits Committee. \n4.3 Corrections and/or changes requested by the Exhibits Committee shall be \nsubmitted to the secretariat of the Exhibits Committee at least one month prior to \nthe exhibit date. \n4.4 The text of ancillary material, such as invitations, brochures and promotional \nmaterial, shall be submitted to the secretariat of the Exhibits Committee for review \nand approval before display or distribution. \n4.5 All exhibits shall be prepared and displayed at no cost to the Secretariat with \nthe exception of exhibits originating from a Secretariat department or office, which \nmust be paid for by that department or office. \n4.6. The Secretariat shall not be responsible for delivering, insuring, storing, \ninstalling, maintaining, dismantling, crating or shipping exhibits, for storage of \nshipping or packing cases during the exhibit, or for any related costs, with the \nexception of exhibits originating from a Secretariat department or office, in which \ncase the department or office concerned shall be responsible for these matters. \n4.7 The secretariat of the Exhibits Committee may change the dates and/or \nlocation of an approved exhibit when necessary. Under such circumstances, the \nsecretariat of the Exhibits Committee shall give as much notice as possible to the \nentity that submitted or supported the exhibit proposal. \n \n \n \nSection 5 \nFinal provisions \n \n \nThe present administrative instruction shall enter into force on 1 May 2008. \n \n \n(Signed) Alicia B\xc3\xa1rcena \nUnder-Secretary-General for Management \n \n"
human resources,"ST/AI/2009/1 \n \n \n09-62311 \n2 \n \n2.2 Overpayment creates on the part of the staff member an indebtedness which \nshall normally be recovered by means of deductions from salaries, wages and other \nemoluments under staff rule 3.17 (c) (ii). However, the Director of the Accounts \nDivision for staff members payrolled in New York, or the Chief of Administration or \nthe Chief Civilian Personnel Officer for staff members payrolled at other duty \nstations, may agree with the staff member who has received overpayments on \nalternative means of repaying the amount due, such as payment by bank cheque or \npersonal cheque from the staff member. \n2.3 If the Organization discovers that an overpayment has been made, the office \nresponsible for the determination and administration of the entitlement shall \nimmediately notify the staff member. That office shall keep a record of such \nnotification. \n2.4 If a staff member discovers that an overpayment has occurred, he or she shall \nadvise the Organization immediately. \n \n \n \nSection 3 \nAmounts to be recovered \n \n3.1 Overpayments shall normally be recovered in full. However, when the \nController determines that the overpayment resulted from an administrative error on \nthe part of the Organization, and that the staff member was unaware or could not \nreasonably have been expected to be aware of the overpayment, recovery of the \noverpayment shall be limited to the amounts paid during the two-year period prior \nto the notification under section 2.3 of the present instruction, or to the advice under \nsection 2.4 of the present instruction, if earlier. Such recovery could, if \ncircumstances so warrant, be made in instalments as determined by the responsible \nofficials referred to in section 2.2 above. Any overpayment in excess of the same \nentitlement that may be made after the date of such notification or advice shall be \nrecovered in full. \n3.2 The two-year limitation provided by section 3.1 of the present instruction shall \nnot apply (a) to the deduction of pension contributions or (b) when the facts indicate \nthat an overpayment was due to the submission of erroneous, fraudulent or \nincomplete information by the staff member. \n \n \n \nSection 4 \nFinal provision \n \n4.1 The present administrative instruction shall enter into force on the date of its \nissuance. \n4.2 Administrative instruction ST/AI/2000/11 of 12 October 2000 is hereby \nabolished. \n \n \n(Signed) Angela Kane \nUnder-Secretary-General for Management \n \n"
human resources,
human resources,"ST/AI/2010/10 \n \n \n10-49396 \n4 \n \nthis programme, the department or office shall take into account the following \nfactors in deciding whether the request should be approved: \n \n(a) \nThe relationship of the studies to the functions of the staff member \nand/or organizational needs; \n \n(b) \nThe suitability of the staff member for the proposed studies; \n \n(c) \nThe quality of the programme and the sponsoring institution; \n \n(d) \nThe expected impact of the proposed training on the staff member\xe2\x80\x99s \nprofessional development and the work of the office or department; \n \n(e) \nThe possibility that the training will have a multiplier effect (that is, for \nthe beneficiary of the training to impart the knowledge gained to other staff \nmembers). \n \n \n \nLeave arrangements \n \n6.3 Staff members participating in training activities outside their office may be \nplaced on special leave with or without pay, in accordance with staff rule 5.3 (a) (i). \nThey may also use accrued annual leave for all or part of the period of study. The \nhead of department at Headquarters or the chief of administration at offices away \nfrom Headquarters may approve special leave with pay for the purposes of the \nprogramme for a period of up to 20 working days or a longer period, in accordance \nwith the applicable delegation of authority. Requests for special leave with pay in \nexcess of the period that may be approved at the department or office level shall be \nsubmitted to the Learning, Development and Human Resources Services Division of \nthe Office of Human Resources Management. \n6.4 In accordance with ST/SGB/2003/4 on flexible working arrangements, staff \nmembers wishing to attend courses relevant to their professional development at \nuniversities or other learning institutions may request breaks of up to three hours per \nday for a maximum of two days per week. The hours spent away from work during a \nparticular week must be made up during that week.  \n \n \n \nSection 7 \nFinal provisions \n \n7.1 The present instruction shall enter into force on the date of its issuance. \n7.2 Administrative instruction ST/AI/1997/4 on upgrading of substantive and \ntechnical skills is hereby superseded and abolished. \n \n \n(Signed) Angela Kane \nUnder-Secretary-General for Management \n \n"
human resources," \nST/AI/2010/2\n \n3 \n10-25454 \n \nResources Services, Office of Human Resources Management for staff serving at \nHeadquarters, and to the Chief of Human Resources Management Services for staff \nserving at offices away from Headquarters and regional commissions, for further \nassessment of its validity. The Assistant Secretary-General for Human Resources \nManagement shall take a final decision on a request for change of date of birth or \nother personal data on behalf of the Secretary-General and inform the staff member \naccordingly. \n2.7 Any entitlement to an allowance, grant or other payment which may result \nfrom the acceptance of a staff member\xe2\x80\x99s request for rectification of personal data \nshall be subject, as appropriate, to staff rule 3.16 on retroactivity of payments. In \nsuch case, calculations for the purpose of retroactivity will start from the date on \nwhich the staff member\xe2\x80\x99s request was accepted. \n2.8 The provisions of paragraph 2.2 above are without prejudice to the obligation \nof the staff member, if the staff member has received or is receiving payments from \nthe Organization based on personal data he or she provided which he or she \nsubsequently discovers to be erroneous, to immediately bring such an error to the \nattention of the Administration. \n \n \n \nSection 3 \n \n \nFinal provisions \n \n3.1 The present administrative instruction shall enter into force on the date of its \nissuance. \n3.2 Administrative instruction ST/AI/354 of 27 July 1988 is hereby abolished. \n \n \n(Signed) Angela Kane \nUnder-Secretary-General for Management \n \n"
human resources," \nST/AI/2010/3\n \n17 \n10-32485 \n \nsuccessful candidates from the national competitive recruitment examination and \nG-to-P examinations shall be granted geographic status.  \n \n \n \nSection 12 \nTransitional measures \n \n12.1 The provisions of ST/AI/2006/3/Rev.1 shall continue to govern recruitment, \nplacement and promotion in respect of applications for job openings advertised \nbefore 22 April 2010 through the \xe2\x80\x9cGalaxy\xe2\x80\x9d system.  \n12.2 The provisions of the present instruction shall apply to the selection process of \ncandidates for positions in the peacekeeping and special political missions initiated \nfrom the effective date of this instruction.  \n12.3 Roster candidates falling under the provisions of section 9.3 of \nST/AI/2006/3/Rev.1 shall maintain their status for the remaining period stipulated \nfor their roster eligibility.  \n \n \n \nSection 13 \nFinal provisions \n \n13.1 The present administrative instruction shall enter into force on 22 April 2010. \n13.2 Administrative instructions ST/AI/2006/3/Rev.1, entitled \xe2\x80\x9cStaff selection \nsystem\xe2\x80\x9d, ST/AI/297 and Add.1, entitled \xe2\x80\x9cTechnical cooperation personnel and OPAS \nofficers\xe2\x80\x9d, and ST/AI/360/Rev.1 and Corr.1, entitled \xe2\x80\x9cMovement of staff from the \nField Service category to the Professional category\xe2\x80\x9d, are hereby abolished.  \n13.3 The provisions of the present administrative instruction shall prevail over any \ninconsistent provisions contained in other administrative instructions and \ninformation circulars currently in force. \n \n \n(Signed) Angela Kane \nUnder-Secretary-General for Management \n \n"
human resources," \nUnited Nations \n \nST/AI/2010/3/Amend.1\n \n \n \nSecretariat \n \n \n29 June 2012 \n \n12-39787 (E)    050712 \n*1239787* \n \n \n \n Administrative instruction \n \n \n \n Staff selection system \n \n \n1. \nPursuant to section 4.2 of Secretary-General\xe2\x80\x99s bulletin ST/SGB/2009/4, the \nUnder-Secretary-General for Management amends as follows administrative \ninstruction ST/AI/2010/3, entitled \xe2\x80\x9cStaff selection system\xe2\x80\x9d. \n2. \nSection 9.4 is replaced by the following text: \n \n9.4 Candidates for position-specific job openings up to and including at the \nD-1 level included in a list endorsed by a central review body other than the \ncandidate selected for the specific position shall be placed on a roster of \ncandidates pre-approved for similar functions at the level of the job opening, \nwhich shall be drawn from all duty stations for job openings in the \nProfessional and above categories and the Field Service category. Following \nthe selection decision, roster candidates shall be retained in a roster \nindefinitely or until such time the present administrative instruction is \namended. Candidates included in the roster may be selected by the head of \ndepartment/office for a subsequent job opening without reference to a central \nreview body. \n3. \nSection 9.5 is replaced by the following text: \n \n9.5 Qualified candidates for generic job openings are placed on the relevant \noccupational roster after review by a central review body and may be selected \nfor job openings in entities with approval for roster-based recruitment. The \nroster candidate shall be retained on an occupational roster indefinitely or until \nsuch time the present administrative instruction is amended. Should an eligible \nroster candidate be suitable for the job opening, the hiring manager may \nrecommend his/her immediate selection to the head of department/office/ \nmission without reference to the central review body. \n4. \nThe provisions of sections 9.4 and 9.5, as amended by the present instruction, \nshall be applicable to all placements on a roster resulting from a selection process \ninitiated on or after 22 April 2010. \n5. \nThe present instruction shall enter into force on the date of its issuance.  \n \n \n(Signed) Yukio Takasu \nUnder-Secretary-General for Management \n \n"
human resources," \nUnited Nations \n \nST/AI/2010/3/Amend.2\n \n \n \nSecretariat \n \n \n16 December 2013 \n \n13-62147 (E)    171213 \n*1362147* \n \n \n \n Administrative instruction \n \n \n \n Staff selection system \n \n \n1. \nPursuant to section 4.2 of Secretary-General\xe2\x80\x99s bulletin ST/SGB/2009/4, and \nfor the purpose of implementing paragraphs 19 and 20 of General Assembly \nresolution 65/247, the Under-Secretary-General for Management amends as follows \nadministrative instruction ST/AI/2010/3, entitled \xe2\x80\x9cStaff selection system\xe2\x80\x9d. \n2. \nSection 9.3 is replaced by the following text: \n \n9.3 When recommending the selection of candidates for posts up to and \nincluding at the D-1 level, the hiring manager shall support such \nrecommendation by a documented record. The head of department/office shall \nselect the candidate he or she considers to be best suited for the functions. In \nthe final selection decision, due consideration should also be given to staff \nmembers who are victims of malicious acts or natural disasters; serving staff \nmembers who have served under the former 200 and 300 series of the Staff \nRules; candidates from troop- or police-contributing countries for positions in \na peacekeeping operation or Headquarters support account-funded positions in \nthe Department of Peacekeeping Operations, the Department of Field Support \nand other departments with support account resources; and prior service or \nemployment of candidates in field duty stations, for positions for which \nrelevant field experience is highly desirable, as applicable and as stipulated in \nGeneral Assembly resolutions 63/250 and 65/247. \n3. \nThe present instruction shall enter into force on the date of its issuance. \n \n \n(Signed) Yukio Takasu \nUnder-Secretary-General for Management \n \n"
